{
  "$schema": "../../schema/table.definition.schema.json",
  "schemaVersion": 1,
  "name": "products",
  "nameJa": "商品",
  "primaryKey": [
    "id"
  ],
  "columns": [
    {
      "name": "id",
      "dataType": "bigint",
      "nameJa": "ID",
      "notNull": true
    },
    {
      "name": "name",
      "dataType": "nvarchar",
      "nameJa": "商品名",
      "notNull": true,
      "length": 200
    },
    {
      "name": "price",
      "dataType": "decimal",
      "nameJa": "価格",
      "notNull": true,
      "precision": 18,
      "scale": 2
    }
  ]
}
