{
  "$schema": "../../../../schema/table.definition.schema.json",
  "schemaVersion": 1,
  "name": "profile",
  "nameJa": "プロフィール",
  "description": "両バージョンで同一（差分なし）",
  "primaryKey": [
    "userId"
  ],
  "columns": [
    {
      "name": "userId",
      "dataType": "bigint",
      "nameJa": "ユーザーID",
      "notNull": true
    },
    {
      "name": "bio",
      "dataType": "nvarchar",
      "nameJa": "自己紹介",
      "length": 500
    }
  ]
}
