{
  "$schema": "../../schema/table.definition.schema.json",
  "schemaVersion": 1,
  "name": "orders",
  "nameJa": "注文",
  "primaryKey": [
    "id"
  ],
  "columns": [
    {
      "name": "id",
      "dataType": "bigint",
      "nameJa": "ID",
      "notNull": true
    },
    {
      "name": "userId",
      "dataType": "bigint",
      "nameJa": "ユーザーID",
      "notNull": true
    },
    {
      "name": "total",
      "dataType": "decimal",
      "nameJa": "合計",
      "notNull": true,
      "precision": 18,
      "scale": 2
    },
    {
      "name": "note",
      "dataType": "nvarchar",
      "nameJa": "備考",
      "length": 500
    }
  ]
}
