{
  "$schema": "../../../schema/table.definition.schema.json",
  "schemaVersion": 1,
  "name": "users",
  "nameJa": "ユーザー",
  "description": "アプリの利用者マスタ（改訂）",
  "primaryKey": [
    "id",
    "email"
  ],
  "columns": [
    {
      "name": "id",
      "dataType": "bigint",
      "nameJa": "ID",
      "notNull": true,
      "remarks": "備考\n２行にしたい"
    },
    {
      "name": "email",
      "dataType": "nvarchar",
      "nameJa": "メールアドレス",
      "notNull": true,
      "unique": true,
      "length": 320
    },
    {
      "name": "createdAt",
      "dataType": "datetime2",
      "nameJa": "作成日時",
      "notNull": true
    },
    {
      "name": "hoge1",
      "dataType": "int",
      "nameJa": "hoge1"
    },
    {
      "name": "hoge2",
      "dataType": "int",
      "nameJa": "hoge2"
    },
    {
      "name": "hoge3",
      "dataType": "int",
      "nameJa": "hoge3"
    }
  ]
}
